{
  "id": "collection:0197b1c4-owned-dw8",
  "handle": "sleepingdragon",
  "entity_type": "game",
  "entity_id": "game:dynasty-warriors-8",
  "status": "playing",
  "progress": {
    "percent": 62.5,
    "completed_units": 25,
    "total_units": 40,
    "unit_label": "stages"
  },
  "platform": "pc",
  "rating": 5,
  "note": "Running the Shu hypothetical route before touching Wei.",
  "started_at": "2026-06-01T18:00:00Z",
  "visibility": "public",
  "meta": {
    "schema_version": "0",
    "created_at": "2026-08-03T00:00:00Z",
    "updated_at": "2026-08-03T00:00:00Z"
  }
}
